{"request_id":"CER-1","project_id":"PROJECT-1","run_id":"RUN-1","capability_index_id":"CI-RUN-1","entry_id":"CAP-SOURCE-QUERY","requested_by_agent_ref":{"id":"AGT-CODER","version":"1.0.0","content_hash":"sha256:bbbbbbbbbbbbbbbbbbbbbbbbbbbbbbbbbbbbbbbbbbbbbbbbbbbbbbbbbbbbbbbb"},"reason":"需要定位认证接口的所有调用方","status":"LOADED","decision_reason":"该能力在 CODING 阶段允许且未超出上下文预算","decided_at":"2026-08-05T12:01:00Z","resolved_ref":"registry:source-query","resolved_version":"1.0.0","loaded_content_hash":"sha256:cccccccccccccccccccccccccccccccccccccccccccccccccccccccccccccccc","context_manifest_ref":"CTX-MANIFEST-2","loaded_at":"2026-08-05T12:02:00Z","requested_at":"2026-08-05T12:00:00Z"}
